section,key,value
usd_summary,,"""재료계 원가율이 1.0%p 감소하여 전체 원가율 개선에 기여하였으나, 아트웍과 공임의 원가율이 각각 0.5%p, 0.4%p 상승하여 일부 상쇄하였습니다. 이는 주로 재료계의 평균단가 감소와 아트웍, 공임의 평균단가 상승으로 인한 결과로, 공정 슬리밍 및 소재 믹스 최적화를 통한 원가 절감 노력이 있었음을 알 수 있습니다."""
krw_summary,,"환율이 5.4% 상승하여 원가율이 1.5%p 악화되었습니다. 이는 환율 효과로 인한 USD 기준 개선 효과를 상쇄한 결과입니다. 평균단가 변동을 보면 아트웍과 공임에서 상승세를 보이고 있어, 이 두 항목이 주요 원인으로 보입니다. 따라서 실손익 관점에서는 비용 상승으로 인한 부정적 영향이 있음을 알 수 있습니다."
action_1,,"원부자재와 아트웍의 변동률이 -0.5%p 감소한 점에 주목하여, 소재 믹스 최적화를 통해 소재비용을 더욱 절감할 수 있습니다. 목표는 원부자재와 아트웍의 원가율을 추가로 0.5~1.0%p 절감하는 것입니다."
action_2,,"공임 변동률이 0.4%p 상승한 점을 고려하여, 봉제 공정의 슬리밍을 통해 공임비를 절감해야 합니다. 구체적으로는 Inner 공정개선 모델을 Outer·Bottom으로 확대 적용하여 공임을 0.5~1.0%p 절감하는 것을 목표로 합니다."
action_3,,"환율 효과로 인해 원가율이 1.2%p 상승한 점을 고려하여, 외화 환헤지를 통해 환율 리스크를 관리해야 합니다. 환율 변동에 따른 원가율 변동을 최소화하려는 목표를 설정해야 합니다."
action_4,,"경비 변동률이 -0.1%p 감소한 점을 고려하여, 더욱 효율적인 경비 관리 방안을 모색해야 합니다. 가능한 한 경비의 추가 절감을 목표로 하며, 이를 위해 벤더 마진 회수 등 다양한 방안을 고려해야 합니다."
risk_1,,"원부자재와 아트웍 비용이 0.5%p 감소하였음에도 불구하고, 원가율이 전체적으로 감소하지 않은 점에서 원재료 가격의 안정성이 떨어질 경우 원가율에 부정적인 영향을 줄 수 있습니다. 따라서, 원재료 가격의 안정성을 위한 공급망 관리가 필요합니다."
risk_2,,"공임 비용이 0.4%p 상승한 점을 보면 인건비 상승에 따른 원가율 증가의 리스크가 있습니다. 공임 비용을 효율적으로 관리하고, 노동 비용 상승에 대한 대응 전략이 필요합니다."
risk_3,,"환율 효과로 인해 1.2%p 원가율이 증가한 점은 환율 리스크에 취약함을 보여줍니다. USD 기준 원가율 개선이 환율 변동에 의해 상쇄될 수 있으므로, 환율 변동에 대한 대응 전략과 효과적인 환율 관리가 필요합니다."
success_1,,24SS에서 25SS로 넘어갈 때 USD 기준 원가율이 22.2%에서 22.0%로 0.2%p 감소하였습니다. 이는 원부자재와 아트웍 변동이 -0.5%p로 비율상 개선이 있었기 때문입니다.
success_2,,공임 변동이 0.4%p 증가하였음에도 불구하고 원가율이 감소한 것은 경비 변동이 -0.1%p로 원가를 절감한 결과입니다.
success_3,,환율 효과로 인해 1.2%p 증가하였음에도 불구하고 원가율이 22.2%에서 22.0%로 감소한 것은 제품 구조 개선과 공정 효율화로 규조적 단가를 절감한 결과입니다.
success_4,,"25SS KRW 원가율이 23.2%로 USD 원가율보다 1.2%p 높다는 점은 환율 변동에 따른 원가 상승을 감안하여, 향후 원가 관리 전략을 개선해야 함을 보여줍니다."
message,,"25SS 시즌은 USD 원가율이 24SS 대비 0.2%포인트 감소한 22.0%를 기록하였고, KRW 원가율은 23.2%로 상승하였습니다. 원부자재와 아트웍 변동이 -0.5%p, 공임 변동이 +0.4%p로 나타나 실질 제조원가가 변동하였습니다. 이는 구조적 원가 방어와 공정 슬리밍, 소싱 다변화를 통해 원가율을 최적화하려는 노력의 일환입니다. 그러나 환율 효과인 1.2%p 상승으로 인해 KRW 원가율이 상승하였습니다. 앞으로는 환율 변동 요인에 덜 의존하고, 원부자재, 공임 등 실질 제조원가 절감에 더욱 집중하여 원가율 개선을 추진하겠습니다."
metrics_title,,"""생산수량 9% 감소에도 원가율 0.2%p 개선: 효율적인 원가 관리로 원가율 하락 성과"""
metrics_volume,,"- 생산수량이 1,116,199개에서 1,016,818개로 감소(YOY: 91.1%)하였습니다. 이는 규모의 경제 효과를 활용하지 못한 결과로, 스케일 메리트 확보가 어려웠음을 의미합니다.
- 이러한 생산 규모 축소는 총판매가와 총생산액 감소에 영향을 미쳤습니다. 총판매가는 86826.6M원에서 74903.6M원으로, 총생산액은 $13.2M에서 $11.5M로 감소하였습니다. 이는 생산 규모 감소로 인한 부작용으로 보입니다.
- 이러한 변화는 시장의 수요 변화에 따른 전략적 물량 조정을 시도하였으나, 생산 규모 감소로 인한 원가율 증가와 매출 감소에 이어 손익 구조의 악화를 초래하였을 가능성이 있습니다."
metrics_tag,,"평균 TAG가 $58.49에서 $56.54로 $1.95 하락하였으며, 이는 약 -3.3%의 변동률을 보여줍니다. 이 TAG의 하락이 원가율을 22.2%에서 22.0%로 0.2%p 개선하는데 일정 부분 기여하였습니다. 그러나 이는 Price Effect에 의한 것으로, 실질적인 원가 절감은 이루어지지 않았습니다. 원가M/U에는 큰 변화가 없음을 확인할 수 있습니다. 결과적으로, TAG의 하락 전략이 원가 상승 압력을 일부 상쇄하여 원가율 개선을 이끌었지만, 실질적인 원가 절감은 이루어지지 않았습니다."
metrics_fx,,"- 환율이 1302.77원에서 1373.09원으로 5.4% 상승하였으며, 이로 인해 KRW 기준 원가율은 21.7%에서 23.2%로 1.5%p 상승하였습니다. USD 기준 원가율은 22.2%에서 22.0%로 개선되었지만, 이 개선 효과는 환율 상승에 의해 상쇄되었습니다. 따라서 실손익 관점에서 볼 때, USD 기준 원가율의 개선이 환율의 악화로 인해 상쇄되며 KRW 원가율이 1.2%p 악화되었습니다. 이는 환율 효과로 인한 실질적인 원가 상승을 의미합니다."
metrics_conclusion,,"- 총 생산수량은 9.1% 감소했으나, 평균 TAG는 96.7%로 소폭 하락하는 등 원가율 관리를 위한 노력이 이루어졌습니다. 그러나 평균 원가는 95.8%로 약간 줄었고, 환율은 5.4% 상승하여 KRW 실손익에는 부정적인 영향을 미쳤습니다. 
- 이러한 상황에서 주요 리스크는 환율 변동과 생산수량 감소입니다. 환율 상승은 원가 절감 노력을 상쇄하며, 생산수량 감소는 판매 물량에 제약을 줍니다. 
- 따라서 향후 전략 방향은 물량 회복과 함께 원가 절감을 통한 원가율 방어가 필요합니다. 특히, 환율 변동에 대비한 리스크 관리도 중요합니다."
executive_summary,,"1. 핵심 성과 요약: 전체 원가율은 22.0%로, 전년 대비 0.2%포인트 감소하였습니다. 평균 TAG와 평균 원가는 각각 전년 대비 96.7%, 95.8% 상승하였습니다.

2. 주요 리스크 및 기회 요인: 현재 원가율 감소는 효율적인 원가 관리를 반영하는 것으로 보이나, 평균 TAG와 평균 원가의 급등은 물가 상승 및 원재료 비용 증가 등의 영향을 받았을 가능성이 있습니다. 이는 원가 관리에 대한 지속적인 모니터링이 필요함을 보여줍니다.

3. 전략적 제언: 물가 상승 및 원재료 비용 증가에 따른 원가 부담을 줄이기 위해, 원재료 구매 전략을 재검토하고, 효율적인 제조 공정 개선에 집중할 필요가 있습니다. 또한, 원가율이 상대적으로 높은 Outer 카테고리에 대한 원가 절감 방안을 모색해야 합니다."
