section,key,value
usd_summary,,"""전체 원가율은 +0.2%p 상승하여 악화되었습니다. 주요 원인은 아트웍 원가율의 0.5%p 상승과 경비 원가율의 0.2%p 상승입니다. 이는 아트웍 평균단가의 $0.27 상승과 경비 평균단가의 $0.10 상승에 기인하며, 실질적인 원가 상승으로 볼 수 있습니다."""
krw_summary,,"환율이 4.6% 상승(1,300원→1,360.40원)하여 USD 원가율은 개선되었으나, 이로 인한 효과가 전체적으로 KRW 원가율 악화(+1.4%p)를 상쇄하지 못했습니다. 특히, 재료계의 평균단가 감소(-0.87)와 경비 평균단가 증가(+0.10)가 주요 원인으로 보이며, 이로 인해 실손익 면에서 비효율적인 상황이 발생하였습니다."
action_1,,"원부자재와 아트웍의 변동률이 -0.2%p 감소하였으므로, 원부자재 구매 비용을 절감하거나 아트웍의 효율성을 높이는 방안을 모색해야 합니다. 예를 들어, 소재 믹스 최적화나 벤더 마진 회수 방안을 적용해보세요."
action_2,,공임의 변동률이 0.1%p 상승하여 공정 슬리밍으로 공임을 0.5~1.0%p 절감하는 것을 목표로 설정해야 합니다. 'Inner 공정개선 모델'을 'Outer·Bottom'으로 확대 적용하는 방식을 고려해보세요.
action_3,,"마진의 변동률이 0.1%p 상승하였으므로, 판매 가격을 적절하게 인상하거나 판매량을 늘려 이를 커버할 수 있도록 해야 합니다. 예를 들어, 시즌별 판매 전략을 수정하거나 신제품 개발을 통해 시장 점유율을 늘리는 방법을 고려해보세요."
action_4,,"환율 효과가 0.8%p로 크게 영향을 미쳤으므로, 환율 변동에 대한 대비책을 마련해야 합니다. 예를 들어, 외환 헤지 전략을 수립하거나 원가 절감을 통해 원가율 0.6~1.0%p 악화 가능성을 줄여보세요."
risk_1,,"환율 효과에 따른 원가율 변동 리스크: 환율 변동에 따른 원가율 변동이 크게 나타났으며, 특히 24SS에서 25SS로 넘어올 때 환율 효과로 인한 원가율이 0.8%p 상승하였습니다. 이는 외환 시장의 변동성이 높아질 경우 원가율에 부정적 영향을 미칠 수 있음을 의미하며, 이에 따른 대응으로는 환율 리스크 관리가 필요합니다."
risk_2,,"원부자재와 아트웍 비용의 변동 리스크: 원부자재와 아트웍 비용의 변동이 -0.2%p로 나타났습니다. 이는 원자재 가격의 변동이나 아트웍 비용의 증가 등으로 인해 원가율이 악화될 가능성을 시사하며, 이를 대응하기 위해서는 세밀한 원가관리가 필요합니다."
risk_3,,"경비 변동에 따른 원가율 변동 리스크: 경비 변동이 0.2%p로 나타났습니다. 이는 운영 비용의 증가가 원가율에 영향을 미칠 수 있음을 의미하며, 이를 관리하기 위해서는 효율적인 경비 관리 전략이 필요합니다."
success_1,,"원가율은 24SS에서 25SS로 0.2%p 상승하였습니다 (17.4% → 17.6%). 이는 공임 변동(+0.1%p)과 경비 변동(+0.2%p)이 주 요인입니다. 이는 전체 원가율에 비교적 작은 영향을 미쳤으나, 관리 포인트로서 주목이 필요합니다."
success_2,,"환율 효과로 인해 원가율이 0.8%p 증가하였습니다. 이는 실질적인 원가 상승이 아닌 환율 변동으로 인한 것으로, 해외 시장에 대한 위험 관리와 환율 변동에 대한 대응 전략이 필요합니다."
success_3,,"원부자재와 아트웍 변동으로 인해 원가율이 0.2%p 감소하였습니다. 이는 소재 믹스 최적화와 규조적 단가 절감 등의 노력이 반영된 결과로, 실질적인 원가 절감 효과를 확인할 수 있습니다."
success_4,,"마진 변동으로 인해 원가율이 0.1%p 상승하였습니다. 이는 벤더 마진 회수가 제한적이므로, 협상력을 통한 구매단가 절감이 필요합니다."
message,,"25SS 시즌은 USD 원가율이 17.4%에서 17.6%로 소폭 상승했으나, KRW 원가율은 18.4%로 증가했습니다. 원부자재와 아트웍의 변동은 -0.2%p로 감소했지만, 공임 변동(+0.1%p), 마진 변동(+0.1%p), 경비 변동(+0.2%p) 등으로 봤을 때 실질 제조원가는 상승했습니다. 또한 환율 효과(+0.8%p)로 인해 원가율이 상승했습니다. 이러한 결과를 바탕으로 다음 시즌에는 공임, 아트웍 등 실질 제조원가 절감에 집중하고, 환율 변동에 따른 원가율 상승을 최소화하는 방향으로 전략을 세워야 합니다."
metrics_title,,"""생산수량 23.4% 증가에도 원가율 0.2%p 상승, USD 기준 생산비용 관리 필요"""
metrics_volume,,"- 생산수량이 5,614,882개에서 6,929,558개로 증가하였으며, 이는 123.4%의 증가율을 보여주고 있습니다. 이러한 대량생산으로 인한 스케일 메리트를 확보하였습니다. 
- 총판매가는 571,216.3M원에서 641,667.9M원으로 증가하였으며, 이는 약 12.3% 증가한 것으로, 고가 제품 믹스 확대 전략이나 생산량 증가에 따른 판매 총액의 증가를 확인할 수 있습니다.
- 반면에, 생산액은 $68.1M에서 $78.9M로 증가하였습니다. 이는 생산 규모의 증가가 원가 증가를 수반하였음을 나타내며, 이는 스케일 메리트의 부작용으로 해석될 수 있습니다. 이에 따라 전략적 물량 조정이 필요할 수 있습니다."
metrics_tag,,"평균 TAG는 $76.49에서 $71.23으로 $5.26 하락(-6.9%)하였으며, 이는 원가율 상승에 영향을 미쳤습니다. TAG의 하락은 원가 상승을 상쇄하지 못하였고, 이로 인해 원가율은 17.4%에서 17.6%로 0.2%p 상승하였습니다. 이러한 결과는 주로 Price Effect에 의한 것으로, 실질 절감보다는 TAG 하락 전략이 원가율에 부정적 영향을 미쳤음을 보여줍니다. 따라서, 원가M/U가 4.18에서 4.27로 0.09 상승한 것은 수익성 개선에 도움이 되었지만, TAG의 하락은 원가율 상승으로 이어져 전체적인 수익성에는 부정적인 영향을 미쳤습니다."
metrics_fx,,"- 환율이 4.6% 상승(1300.00원→1360.40원)하면서 KRW 기준 원가율이 1.4%p 증가(17.0%→18.4%)하였습니다. USD 기준 원가율 개선 효과는 환율 악화로 인해 상쇄되었습니다.
- 실손익 관점에서 볼 때, 환율 효과가 0.8%p로 반영되어 KRW 원가율의 악화를 가져왔습니다. 따라서 환율 변동이 원가율과 실손익에 부정적인 영향을 미쳤습니다."
metrics_conclusion,,"- 전체적으로 총생산수량은 123.4% 증가했으나, 물량 증가에 비해 TAG는 93.1%로 감소하였습니다. 이는 태그 인상 전략이 제대로 작동하지 않았음을 보여줍니다.
- 원가율은 약간 상승한 17.6%를 보였으나, 평균 원가는 94.0%로 감소하여 원가율 방어에는 성공했습니다. 하지만 환율이 104.6%로 급등하여 KRW 실손익은 압박받는 상황입니다.
- 이런 상황에서 향후 전략 방향은 첫째, TAG 인상 전략을 재검토하여 매출 성장을 위한 물량 관리에 집중해야 하며, 둘째, 환율 변동에 대비한 위험 관리 전략을 마련해야 합니다. 
- 특히, 유리한 환율을 확보하여 KRW 실손익을 최소화하는 것이 중요하며, 이를 위해 환율위험 관리 전략을 수립하는 것이 필요합니다."
executive_summary,,"1. 핵심 성과 요약: 25SS 시즌의 전체 원가율은 17.6%로, 전년 대비 0.2%p 상승했습니다. 또한 평균 TAG와 평균 원가는 각각 93.1%, 94.0%의 YoY 성장을 보였습니다.

2. 주요 리스크 및 기회 요인: 원가율이 소폭 상승한 것은 원재료 가격 상승 등 외부 요인에 의한 것일 수 있으며, 이는 이익률에 영향을 미칠 수 있습니다. 그러나 평균 TAG와 원가의 큰 상승은 판매 가격과 원가의 적절한 관리로 인한 것으로 판단되며, 이는 매출 성장의 기회를 제공합니다.

3. 전략적 제언: 원가 상승에 대응하기 위해 원재료 구매 전략을 재검토하고, 비용 절감 방안을 모색할 필요가 있습니다. 또한, 판매 가격과 원가의 적절한 관리를 통해 이익률을 극대화하는 방향으로 가격 전략을 세우는 것이 중요합니다."
