section,key,value
usd_summary,,"25SS 원가율은 전체적으로 3.2%p 상승하였는데, 이는 주로 공임 원가율의 2.0%p 상승 때문입니다. 공임 평균단가도 $1.01 상승하였으며, 이는 공정 슬리밍 미흡과 벤더 마진 상승 등이 원인으로 보입니다. 이는 실질적인 원가 상승을 의미하며, 원가 절감을 위한 대책 마련이 필요합니다."
krw_summary,,"환율이 1.6% 상승한 것에 따라 원가율이 3.7%p 악화되었으며, 이는 공임 평균단가의 큰 증가(+1.01)에 주로 기인합니다. 따라서 이로 인한 실손익 증가와 함께, 더욱 높아진 환율로 인한 USD 기준 개선 효과가 상쇄되었습니다."
action_1,,원부자재와 아트웍 비용이 0.8%p 상승했습니다. 이를 줄이기 위해 소재 믹스 최적화를 통해 원부자재 구매 비용을 절감하고 아트웍 단가를 재협상하자. 목표는 원부자재와 아트웍 비용을 0.3~0.5%p로 절감하는 것입니다.
action_2,,공임이 2.0%p 상승했습니다. 이를 최소화하기 위해 공정 슬리밍을 통해 불필요한 작업을 줄이고 효율적인 공장으로 물량을 축소하자. 목표는 공임을 0.5~1.0%p 절감하는 것입니다.
action_3,,"마진이 0.5%p 상승했습니다. 벤더와의 재협상을 통해 벤더 마진을 회수하고, 가격 전략을 재검토하여 마진 상승을 최소화하자. 목표는 마진 상승을 0.2~0.3%p로 제한하는 것입니다."
action_4,,"환율 효과로 인해 원가율이 0.5%p 상승했습니다. 환율 변동에 따른 리스크를 관리하기 위한 방안을 마련하고, 외환 헤지 전략을 강화하자. 목표는 환율 효과로 인한 원가율 상승을 0.2~0.3%p로 제한하는 것입니다."
risk_1,,"원부자재와 아트웍 비용의 변동으로 인한 원가율 상승이 0.8%p 발생하였습니다. 이는 원부자재 가격의 상승과 아트웍 비용의 증가로 인한 원가율의 상승을 의미하며, 이는 원자재 리스크로 볼 수 있습니다. 이에 따른 원가관리의 중요성이 강조됩니다."
risk_2,,"공임 변동으로 인한 원가율이 2.0%p 상승하였습니다. 이는 제품 생산에 필요한 인건비가 증가하여 원가율이 상승한 것을 의미하며, 이는 인건비 리스크로 볼 수 있습니다. 이에 따라 인건비 절감 및 효율적인 인력 관리 전략이 필요합니다."
risk_3,,"환율 효과로 인한 원가율 변동이 0.5%p 발생하였습니다. 이는 환율 변동에 따른 원가율의 변동을 의미하며, 이는 환율 리스크로 볼 수 있습니다. 이에 따라 환율 변동에 대비한 헷지 전략을 세우는 것이 필요합니다."
success_1,,"24SS에서 25SS로 원가율이 3.2%p 증가하였습니다 (23.0% → 26.2%). 이는 원부자재와 아트웍 변동에 따른 결과로, 비율상 개선이 이루어진 것입니다."
success_2,,"공임 변동으로 인해 원가율이 2.0%p 상승하였습니다. 이는 생산비용의 상승을 반영한 것으로, 실질적인 원가 증가를 의미합니다."
success_3,,"마진 변동으로 인해 원가율이 0.5%p 증가하였습니다. 이는 판매 가격에 대한 이익률 변화로, 벤더 마진 회수를 통한 실질적인 개선을 의미합니다."
success_4,,"환율 효과로 인해 원가율이 0.5%p 증가하였습니다. 이는 환율 변동에 따른 비용 변화를 반영한 것으로, 환율 리스크 관리를 통한 개선사항으로 볼 수 있습니다."
message,,"24SS에서 25SS로 넘어오며 USD 기준 원가율은 23.0%에서 26.2%로, KRW 기준으로는 26.7%로 증가했습니다. 이는 원부자재와 아트웍 변동이 0.8%p, 공임 변동이 2.0%p 상승하여 원가율이 상승하였습니다. 또한 마진 변동은 0.5%p, 경비 변동은 0.1%p, 환율 효과는 0.5%p로 각각 변동하였습니다. 그러나 이러한 변동들은 원가율 상승을 가져왔음에도 불구하고, 실질 개선을 가져오지는 못했습니다. 따라서 앞으로는 가격 효과에 의존하는 것이 아니라, 공임, 아트웍 등의 실질 제조원가 절감에 집중하여 구조적 원가 방어를 통한 지속 가능한 수익성을 확보하는 전략을 수립해야 합니다."
metrics_title,,"""생산수량 56.0% 감소에도 불구, USD 원가율 3.2%p 상승으로 원가 부담 증가"""
metrics_volume,,"- 생산수량이 140,553개에서 61,950개로 감소(YOY: 44.1%)하며, 스케일 메리트를 확보하지 못했습니다. 이는 총판매가 18570.1M원에서 7524.1M원으로 감소(59.5%)하는 결과를 가져왔습니다.
- 이러한 생산 규모의 축소는 시장 환경 변화 혹은 전략적 물량 조정으로 인한 것으로 보이며, 이로 인해 총생산액이 $2.9M에서 $1.3M로 감소(55.2%)하였습니다. 이는 규모의 경제 효과를 누리지 못하고, 단가 상승 등의 부작용을 초래하였을 가능성이 있습니다."
metrics_tag,,"- 평균 TAG가 $99.34에서 $91.32로 $8.02 하락하였으며, 이는 약 8.1%의 감소를 의미합니다. 반면, 원가율은 23.0%에서 26.2%로 3.2%p 상승했습니다. 이런 결과를 보면, TAG의 하락이 원가율 상승을 상쇄하지 못하였음을 알 수 있습니다. 따라서, 이 경우에서는 TAG 하락 전략이 원가율 개선에 도움이 되지 않았습니다. 실질 절감보다는 Price Effect에 의한 원가율 상승이 주요한 원인으로 보입니다."
metrics_fx,,"- 환율이 1.6% 상승(1330.00원→1351.70원)하였고, 이로 인해 KRW 기준 생산단가는 3.7%p 증가하였습니다. USD 기준 원가율은 3.2%p 개선되었지만, 이는 환율의 악화로 인해 상쇄되었습니다. 결과적으로, 실손익 관점에서 KRW 원가율은 0.5%p 악화되었습니다. 따라서 환율 변동의 영향으로 원가율 개선 효과를 보지 못하였습니다."
metrics_conclusion,,"- 총 생산 수량은 전년 대비 44.1% 감소했으나, 평균 TAG는 91.9%로 유지되며 USD 기준 원가율은 3.2%p 상승한 26.2%를 기록했습니다. 이는 물량 감소에도 불구하고 TAG 인상 전략이 일부 효과를 보였음을 의미합니다.
- 그러나 평균 원가는 105.1%로 증가하였고, 환율은 101.6%로 상승하여 KRW 실손익은 압박받는 구조입니다. 이는 환율 변동과 원가 상승으로 인한 리스크가 현실화된 것을 보여줍니다.
- 이런 상황에서 향후 전략은 두 가지로 요약될 수 있습니다. 첫째, 생산 수량의 회복을 통한 규모의 경제 효과를 활용한 원가율 방어가 필요합니다. 둘째, 환율 리스크 관리를 강화하여 KRW 실손익 압박을 완화하는 것이 중요합니다.
"
executive_summary,,"1. 핵심 성과 요약: 25SS 시즌의 전체 원가율은 26.2%로 전년 대비 3.2%p 상승하였습니다. 또한 평균 TAG와 평균 원가는 각각 91.9%, 105.1%로 YOY 증가하였습니다.

2. 주요 리스크 및 기회 요인: 원가율의 상승은 판매 가격에 영향을 미치므로, 이익률 감소의 리스크를 내포하고 있습니다. 반면에, 카테고리별로 보면 Outer와 Bottom의 원가율이 높은 반면, Acc_etc의 원가율은 상대적으로 낮습니다. 이는 Acc_etc 카테고리에서의 기회를 시사합니다.

3. 전략적 제언: 원가 관리를 통해 이익률을 개선해야 합니다. 특히, 원가율이 높은 Outer와 Bottom 카테고리에 대한 원가 절감 전략을 수립할 필요가 있습니다. 또한, 원가율이 낮은 Acc_etc 카테고리에 대한 판매 전략을 강화하여, 이익률을 높일 수 있는 기회를 활용해야 합니다."
