section,key,value
usd_summary,,"""재료계 원가율이 -1.7%p 감소하였으며, 이는 전체 원가율 개선의 주요 원인으로 보입니다. 그러나 평균단가는 모든 항목에서 상승하였고, 특히 공임과 재료계에서 큰 상승을 보였습니다. 이는 TAG의 큰 상승과 원가의 상승으로 믹스 효과에 의한 비율상 개선이라고 판단됩니다."""
krw_summary,,"25SS 시즌의 전체 원가율은 24SS 대비 2.0%p 개선되었습니다. 주요 원인은 환율 하락 (-2.3%)에 따른 효과와 평균 원가의 큰 상승 (+58.2%)으로 보입니다. 환율 효과가 원가율 개선에 기여했지만, USD 기준으로 볼 때는 원가율이 0.5%p 악화되어 환율 효과로 인한 개선이 상쇄되었습니다. 가장 큰 변동을 보인 항목은 공임과 재료계로, 이들의 평균단가가 각각 $8.96, $7.90 상승했습니다. 이런 결과로 실손익 관점에서는 비용이 크게 증가했습니다."
action_1,,"원부자재와 아트웍 변동이 -1.9%p 감소하였으므로, 공급 체인 최적화를 통해 추가적인 원가 절감을 추구해야 합니다. 이를 위해 소재 믹스 최적화를 진행하고, 벤더와의 협상을 통해 원부자재 가격을 추가로 내릴 수 있는 방안을 모색해야 합니다."
action_2,,"공임은 변동이 없었으나, 생산 공정을 개선하여 공임비를 줄이는 방향으로 진행해야 합니다. 특히, Inner 공정개선 모델을 Outer·Bottom으로 확대 적용하여 공임을 0.5~1.0%p 절감하는 것을 목표로 합니다."
action_3,,"경비 변동이 0.4%p 상승하였으므로, 내부 재무 관리를 통해 비용을 절감할 수 있는 부분을 찾아야 합니다. 이를 위해 비효율적인 경비 항목을 파악하고, 필요치 않은 비용을 줄이는 방향으로 재무 관리 전략을 수립해야 합니다."
action_4,,"환율 효과가 -0.5%p 감소한 점을 고려하여, 환율 변동에 따른 원가 영향을 최소화하기 위한 방안을 모색해야 합니다. 이를 위해 외환 리스크 관리 전략을 수립하고, 환율 변동에 따른 원가율 피해를 줄이기 위한 대응책을 마련해야 합니다."
risk_1,,"원부자재와 아트웍의 변동이 -1.9%p로 감소한 것으로 보아, 원자재 가격이나 아트웍 제작 비용의 상승이 원가율 악화의 주요 원인일 수 있습니다. 이는 원자재 리스크로 인식되며, 가격 변동에 따른 원가 관리 전략이 필요합니다."
risk_2,,"환율 효과가 -0.5%p로 나타난 것으로 보아, 환율 변동이 원가율에 중요한 영향을 미치는 것으로 보입니다. 이는 환율 리스크를 의미하며, 환율 변동에 대비한 헤지 전략이 필요합니다."
risk_3,,"경비 변동이 0.4%p로 나타난 것으로 보아, 경비 관리가 원가율에 영향을 미칠 수 있습니다. 이는 경비 관리 리스크로, 효율적인 경비 관리를 통한 원가율 개선이 필요합니다."
success_1,,"24SS에서 25SS로 원가율이 USD 기준으로 1.4%p 감소하였습니다(22.6% → 21.2%). 이는 원부자재와 아트웍의 원가 절감(-1.9%p)에 기인한 결과로, 소재 믹스 최적화를 통한 비율상 개선 효과를 확인할 수 있습니다."
success_2,,"환율 효과에 따른 원가율 변동을 고려하면, KRW 기준으로는 원가율이 20.7%로 더욱 개선되었습니다. 이는 환율 변동에 따른 규조적 단가 절감이 포함된 결과로, 실질적인 원가 절감 효과를 보여줍니다."
success_3,,"공임 변동이 없는 것은 우리의 효율적인 공정관리와 벤더와의 협상력을 보여줍니다. 이는 실질적인 개선이며, 이를 통해 생산 효율성을 유지하였음을 확인할 수 있습니다."
success_4,,"경비 변동이 0.4%p 증가하였습니다. 이는 운영비 또는 기타 경비에 대한 효율성 개선이 필요함을 시사하며, 이를 통해 추가적인 원가 절감 효과를 기대할 수 있습니다."
message,,"25SS 시즌은 24SS 시즌 대비 USD 원가율이 1.4%p 감소(22.6%에서 21.2%로)하였으며, KRW 원가율 또한 20.7%로 개선되었습니다. 이는 주로 원부자재와 아트웍의 변동이 -1.9%p로 감소한 결과입니다. 그러나 실질적인 개선이 아닌 비율상의 개선으로, 경비는 0.4%p 상승하였고, 환율의 효과로 인해 -0.5%p의 변동이 발생하였습니다. 앞으로의 전략 방향은 환율 효과 의존도를 줄이고, 실질 제조원가 절감에 집중하며, 특히 공임과 아트웍 비용을 절감하여 지속 가능한 수익성을 확보해야 할 것입니다."
metrics_title,,"""생산수량 80% 감소에도 USD 원가율 1.4%p 하락으로 원가 효율성 개선"""
metrics_volume,,"- 생산수량이 136,164개에서 27,300개로 감소하였으며, 이는 전년 대비 20%로 크게 줄어든 것을 확인할 수 있습니다. 이러한 감소는 스케일 메리트를 누리지 못하게 하였고, 이로 인해 원가율 증가의 압력을 받았을 가능성이 있습니다.
- 반면, 총판매가는 31644.7M원에서 10965.6M원으로, 총생산액은 $4.9M에서 $1.6M로 변화하였는데, 이는 생산 규모의 축소와 함께 판매액과 생산액이 크게 감소한 것으로 보아 전략적 물량 조정이 이루어졌을 수 있습니다."
metrics_tag,,"- 평균 TAG가 $174.74에서 $302.01로 상승하였는데(+72.8%), 이는 원가율의 하락을 유도하였습니다. TAG 상승 전략이 원가 증가를 상쇄하고 원가율을 1.4%p 개선하여 22.6%에서 21.2%로 하락하였습니다. 따라서, TAG 상승은 원가율 개선에 긍정적인 영향을 미쳤습니다.
- 이는 Price Effect에 의한 결과로, 실질적인 원가 절감보다는 가격 상승이 원가율 개선에 기여하였습니다. 원가M/U는 변동이 없어 실질 절감은 이루어지지 않았습니다."
metrics_fx,,"- 환율이 2.3% 하락(1330.00원→1300.00원)했으나, 이는 원가율의 감소를 상쇄하지 못했습니다. USD 기준 원가율은 1.4%p 개선되었지만, 환율 효과로 인한 -0.5%p의 실질적인 손실이 발생했습니다.
- 따라서, USD 기준 원가율의 개선 효과가 환율 하락으로 인해 상쇄되었고, 이에 따른 KRW 기준 원가율은 2%p 감소하였습니다.
- 실손익 관점에서 볼 때, 환율과 원가율의 변화는 회사에게 불리한 상황을 만들었습니다. 환율의 하락과 원가율의 감소는 실질적인 수익 감소를 가져왔습니다."
metrics_conclusion,,"- 총생산 수량은 20.0% 감소했지만, TAG 인상 전략으로 인해 평균 TAG는 172.8% 증가하였습니다. 이에 따라 원가율은 1.4%p 감소하여 21.2%를 기록했습니다. 
- 그러나 평균 원가는 162.5% 증가하였고, 환율은 97.7%로 감소하였습니다. 이러한 환율 변동으로 KRW 기준 실손익에 압박이 가해지고 있습니다. 
- 이에 따라, 향후 전략 방향으로는 총생산 수량의 회복과 원가 절감이 중요하며, 환율 변동에 따른 리스크 관리도 필요하다고 볼 수 있습니다. 
- 또한, TAG 인상 전략을 통한 원가율 방어 전략도 지속적으로 추진해야 할 것으로 보입니다."
executive_summary,,"1. 핵심 성과 요약: 25SS 시즌의 전체 원가율은 21.2%로, 전년 대비 1.4%p 감소하였습니다. 평균 판매가와 평균 원가는 각각 전년대비 172.8%, 162.5% 증가하였습니다.

2. 주요 리스크 및 기회 요인: Bottom 카테고리의 원가율이 다른 카테고리에 비해 높아, 이 부분이 수익성 저하의 주요 요인으로 작용할 수 있습니다. 그러나 전체 원가율이 감소하였으며, 판매가와 원가의 증가율 차이로 인한 마진 확대 가능성이 있습니다.

3. 전략적 제언: Bottom 카테고리의 원가 절감 방안을 모색하며, 판매가와 원가의 증가율 차이를 활용한 가격 전략을 검토할 필요가 있습니다. 또한, 원가율 감소 트렌드를 유지하기 위해 전체 공정의 효율성을 향상시키는 전략을 고려해야 합니다."
