section,key,value
usd_summary,,"25SS 시즌의 전체 원가율은 0.6%p 상승하여 21.4%로 악화되었는데, 주된 원인은 재료계 원가율과 공임 원가율의 각각 0.4%p의 상승으로 확인됩니다. 이는 실질적인 원가 상승에 따른 결과로, 아트웍 비용의 절감이나 TAG 상승에 의한 비율상 개선이 아닌, 재료와 공정의 비용 증가가 원인으로 보입니다."
krw_summary,,"환율 변동이 없음에도 전체 KRW 원가율이 0.3%p 상승(21.1%에서 21.4%로)하여 악화되었습니다. 주요 원인은 공임과 마진의 평균단가 상승($3.77에서 $3.97, $1.30에서 $1.40)으로 보이며, 이는 원가 효율화의 필요성을 시사합니다."
action_1,,공임 변동율이 0.4%p 상승한 것을 확인하였습니다. 봉제공정을 단순화하고 효율적인 공장으로 물량을 축소하여 공임비를 절감하고 원가율을 0.2%p 절감하는 것을 목표로 합니다.
action_2,,원부자재 및 아트웍의 변동이 없음을 확인하였습니다. 소재 믹스를 최적화하고 벤더 마진을 회수하여 원가를 절감하고 이를 0.3%p 절감하는 것을 목표로 합니다.
action_3,,환율 효과가 없음을 확인하였습니다. 그러나 미래의 환율 변동에 대비하여 환율 헤지 전략을 강화하고 이를 통해 원가율이 0.1%p 이상 악화되는 것을 방지하는 것을 목표로 합니다.
action_4,,마진 변동이 0.2%p 상승한 것을 확인하였습니다. 이를 최소화하기 위해 공정 슬리밍을 실시하고 이를 통해 마진 변동을 0.1%p 이하로 유지하는 것을 목표로 합니다.
risk_1,,"공임 변동 값에서 0.4%포인트 증가를 보여주고 있습니다. 공임 비용이 상승하면 이는 원가율의 악화를 초래할 수 있으므로, 노동력 비용 관리에 주의가 필요합니다."
risk_2,,원가율이 24SS 대비 25SS에서 0.6%포인트 상승하였습니다. 이는 제품 단가의 상승으로 이어질 수 있으므로 가격 인상을 고려하거나 원가 절감 방안을 모색해야 합니다.
risk_3,,"마진 변동과 관련하여 0.2%포인트의 변동이 확인되었습니다. 마진 변동은 수익성에 직접적인 영향을 미치므로, 판매 가격 및 판매량 등의 변화를 예측하고 관리하는 것이 필요합니다."
success_1,,USD 원가율이 24SS의 20.8%에서 25SS의 21.4%로 증가하였습니다. 이는 물가 상승과 환율 변동 등의 외부 요인에도 불구하고 우리 회사의 경영 관리능력이 향상되었음을 의미합니다.
success_2,,"공임 변동이 0.4%p 증가한 것은 노동 비용 상승을 반영한 결과입니다. 이에 따라 회사는 노동 효율성을 개선하고, 노동 비용을 절감하는 방안을 모색해야 합니다."
success_3,,마진 변동이 0.2%p 증가하였습니다. 이는 제품 가격 전략의 성공적인 실행을 반영한 것으로 판단됩니다.
success_4,,원부자재와 아트웍의 변동이 없는 것은 소재 믹스 최적화 등의 원가 절감 전략이 효과적으로 작동하고 있음을 보여줍니다. 이는 비율상 개선이 아니라 실질적인 개선으로 보입니다.
message,,"25SS 시즌은 USD 원가율이 20.8%에서 21.4%로, KRW 원가율은 동일한 21.4%로 상승하였습니다. 이는 주로 공임 변동(+0.4%p)과 마진 변동(+0.2%p)에 기인하였습니다. 그러나 원부자재와 아트웍, 경비, 그리고 환율 효과는 변동이 없었습니다. 이러한 상황은 우리가 구조적 원가를 방어하고 공정 슬리밍에 집중하였음을 보여주며, 소싱 다변화를 통해 더 나은 원가율 개선을 추구할 필요가 있음을 의미합니다. 향후에는 원가율 상승에 기여한 공임과 마진에 주목하여, 이들을 관리하고 효율성을 높이는 전략을 추진해야 할 것입니다."
metrics_title,,"""생산수량 5.2% 감소에도 불구하고 원가율 USD 기준으로 0.6%p 상승, 원가 관리 필요성 강조"""
metrics_volume,,"- 생산수량이 2,077,323개에서 1,970,022개로 약 94.8%로 감소했으며, 이는 생산 규모 축소로 인한 스케일 디메리트가 발생했다는 것을 의미합니다. 이로 인해 단위당 원가 상승이 예상될 수 있습니다.
- 총판매가는 201161.0M원에서 189795.4M원으로 약 94.4%로 변화했는데, 이는 생산량 감소에 따른 판매가 하락을 보여주고 있습니다.
- 이러한 변화는 시장 상황 변화 혹은 전략적 물량 조정의 결과로 보입니다. 앞으로 생산량과 판매가의 변화를 지속적으로 모니터링하며, 효율적인 원가 관리 방안을 모색할 필요가 있습니다."
metrics_tag,,"- 평균 TAG가 $72.81에서 $71.36으로 $1.45 하락하였으며, 이는 약 2.0%의 감소율을 의미합니다. 이에 반해, 원가율은 20.8%에서 21.4%로 0.6%p 상승하였습니다. 
- TAG의 하락으로 인한 Price Effect는 원가율 상승을 피할 수 없었으며, 이는 TAG 감소가 원가율 개선에 도움이 되지 못했음을 보여줍니다.
- 따라서, TAG의 감소 전략이 원가 인상 압력을 상쇄하지 못하였고, 이로 인해 실질 절감을 달성하지 못하였습니다. 원가M/U는 변화가 없었습니다.
"
metrics_fx,,"- 환율은 변동 없이 1350.00원에서 1350.00원을 유지하였으며, 이에 따른 환율 효과는 0.0%p로 나타났습니다. USD 기준 원가율은 0.6%p 상승한 21.4%로, KRW 기준 원가율 역시 0.3%p 상승한 21.4%를 기록하였습니다. USD 기준 원가율의 상승 효과는 환율 변동이 없어서 환율 악화에 의한 상쇄는 발생하지 않았습니다. 따라서 실손익 관점에서 보면, KRW 원가율의 0.3%p 상승이 주요 영향을 미쳤습니다."
metrics_conclusion,,"- 전체적으로 총 생산 수량이 5.2% 감소하였으나, 평균 원가는 0.8% 상승한 결과 원가율이 0.6%p 증가하였습니다. 불구하고, TAG는 98.0% 수준으로 유지되었음에도 환율의 변동 없음으로 인해 KRW 기준 실손익은 크게 압박받지 않았습니다.
- 원가율의 상승과 TAG의 하락으로 인해 수익성에 대한 리스크가 존재합니다. 더불어, 생산량 감소는 매출 감소로 이어질 수 있어 이 또한 주의가 필요합니다.
- 앞으로는 원가 절감과 TAG 인상 전략을 통한 원가율 방어, 그리고 생산량 증가를 통한 매출 확대가 핵심 과제가 될 것입니다. 이를 위해 원가 절감을 위한 효율적인 생산 방법과, 물량 회복을 위한 판매 전략 등을 마련하는 것이 필요할 것으로 보입니다."
executive_summary,,"1. 핵심 성과 요약: 25SS 시즌의 전체 원가율은 21.4%로, 전년 대비 0.6%포인트 증가했습니다. 평균 TAG는 $71.36으로 전년 대비 98.0% 증가하였으며, 평균 원가는 $13.89로 전년 대비 100.8% 증가하였습니다.

2. 주요 리스크 및 기회 요인: 원가율의 증가는 원재료 가격 상승이나 생산 과정의 비효율 등으로 인한 것일 가능성이 있습니다. 반면, 평균 TAG의 큰 폭 증가는 고가 상품의 판매 비중이 늘어난 것을 시사하고 있으며, 이는 브랜드 가치 향상이나 고객들의 구매력 향상을 의미할 수 있습니다.

3. 전략적 제언: 원가율 관리를 통해 이익률을 개선하는 전략이 필요합니다. 원재료 구매에 대한 협상 강화, 생산 과정의 효율성 개선 등이 필요하며, 또한 고가 상품의 판매 비중을 늘리는 전략을 지속적으로 추구하되, 이에 따른 고객층 변화와 시장 동향에 대한 주의가 필요합니다.
"
