section,key,value
prev_usd_cost_rate,,17.6
prev_krw_cost_rate,,18.4
usd_summary,,26SS 시즌 USD 기준 원가율은 17.6%에서 18.0%로 +0.4%p 악화되었습니다. 주요 원인은 공임 원가율 +0.8%p 변동입니다.
krw_summary,,당년 USD 원가율 18.0%에서 환율 변동 효과로 당년 KRW 원가율은 18.2%로 나타났습니다.
action_1,,공임 효율화: 공임 원가율 상승(+0.8%p)으로 봉제 자동화 및 작업공정 단순화 추진.
risk_1,,환율 변동성: 환율 급변 시 원가율 변동 확대 가능성.
risk_2,,원자재 가격: 글로벌 원자재 시장 불안정성.
success_1,,공임비 관리: 공임 원가율 +0.8%p 상승으로 생산 효율성 개선 필요. 공정 단순화 및 생산지 다변화 검토.
action summary,,주요 액션: 공임 효율화
risk summary,,"주요 리스크: 환율 변동성, 원자재 가격"
success summary,,성공 포인트: 공임비 관리
message,,"26SS 시즌은 USD 기준 +0.4%p 악화, KRW 기준 0.2%p 개선되었습니다. 환율 안정이 KRW 원가율에 미치는 영향이 제한적이었습니다. 단기적으로는 세부 항목별 원가 모니터링, 중기적으로는 소싱 다변화와 공임 효율화를 통한 구조적 원가 방어가 필요합니다."
metrics_title,,주요 지표 요약
metrics_volume,,생산 수량은 전시즌 대비 -55.7% 감소했습니다.
metrics_tag,,평균 TAG는 전시즌 대비 +12.3% 상승했습니다.
metrics_fx,,환율은 1360원에서 1380원으로 +1.4% 상승했습니다.
metrics_conclusion,,"전체적으로 수량 -55.7% 변동, TAG +12.3% 변동, 원가 +14.7% 변동으로 안정세를 보였습니다."
executive_summary,,"26SS 시즌 원가 분석 결과, USD 기준 원가율은 17.6%에서 18.0%로 +0.4%p 악화되었습니다. KRW 기준으로는 0.2%p 개선되었으며, 환율 변동이 영향을 미쳤습니다. 세부 항목별 원가율 모니터링과 구조적 원가 절감 노력이 필요합니다."