section,key,value
<<<<<<< Updated upstream
usd_summary,,"데이터를 확인해보니, 26SS 시즌에 전체 원가율이 변동하지 않아 상세한 원인 분석이 불가능합니다. 실제 데이터를 확인하여 재분석이 필요할 것으로 보입니다."
krw_summary,,"환율이 3.7% 하락(1350원 → 1300원)한 것에도 불구하고 전체 KRW 원가율이 0.0%p 악화되었습니다. 이는 주요 항목인 재료계, 아트웍, 공임, 마진, 경비의 원가율이 모두 0.0%p 상승한 결과입니다. 이로 인해 실손익 관점에서도 전체 원가가 ₩0에서 ₩0로 변동하며 100.0% 감소하였습니다. 이는 효율성이 저하되었음을 시사합니다."
message,,"25SS에서 26SS로 이동하면서 모든 원가율과 경비 변동, 환율 효과 등이 0.0%로 유지되는 등 변화가 없었습니다. 이는 원부자재와 아트웍, 공임 비용 등이 전혀 변하지 않았음을 의미하며, 이러한 상황은 구조적 원가 방어가 효과적으로 이루어졌음을 보여줍니다. 실질적인 제조원가나 마진에도 변화가 없었기 때문에, 현재의 경영 전략이 안정적이라는 것을 알 수 있습니다. 그러나 다음 시즌에는 소싱 다변화 및 공정 슬리밍 등을 통해 제조원가 절감에 더욱 집중하고, 시장 변화에 빠르게 대응할 수 있는 유연한 원가 관리 전략이 필요할 것입니다."
metrics_title,,"""생산수량 및 USD 원가율 동일하게 유지: 생산수량 0% 변동 및 USD 원가율 0.0%p 하락으로 안정적인 경영 지속"""
metrics_volume,,"안타깝게도, 제시해주신 데이터에는 특정 수치가 없어서 구체적인 분석이 불가능합니다. 정확한 수치와 변화률을 포함한 데이터를 제공해주시면, 그에 따른 원가유형 분석과 스케일 메리트, 전략적 물량 조정 등에 관한 분석을 제공하겠습니다."
metrics_tag,,"주어진 정보에 따르면, 평균 TAG와 원가율 모두 하락했습니다. 하지만, 구체적인 수치가 제공되지 않아 분석을 진행하거나 TAG와 원가율의 상관관계를 명확히 설명하기 어렵습니다.

일반적으로, TAG가 상승하면 원가율이 감소하는 경향이 있습니다. 이는 TAG 상승 전략이 원가 인상 압력을 상쇄하여 원가율 개선을 도울 수 있기 때문입니다. 그러나 이 경우, TAG와 원가율 모두 하락했으므로, TAG의 하락이 원가율의 하락을 초래했을 가능성이 있습니다.

정확한 분석을 위해서는 평균 TAG와 원가율의 구체적인 변화율과 수치가 필요합니다."
metrics_fx,,"- 환율이 3.7% 하락(1350.00원→1300.00원)하여 KRW 기준 생산단가는 변동이 없었습니다. USD 기준 원가율도 변화가 없어 환율의 하락이 원가에 미치는 영향이 없었습니다. 그 결과, 실손익 관점에서도 원가율의 변화는 없었으며, 환율 효과도 0.0%p로 나타났습니다."
metrics_conclusion,,"현재의 데이터를 보면, 총 생산 수량, 원가율, 평균 TAG, 평균 원가 모두 전년도 대비 변동이 없다는 점에서 본격적인 사업 활동이 이루어지지 않았음을 알 수 있습니다. 다만, 환율은 96.3% 상승하여 1300원으로 급등했는데 이는 매우 큰 리스크 요인으로 작용할 수 있습니다. 

환율의 급등으로 인해 USD 기준 원가율은 변동이 없음에도 불구하고 KRW 실손익은 큰 압박을 받을 수 있습니다. 이와 같은 상황에서는 환율 변동에 대한 대응 전략을 수립하는 것이 필요합니다. 환율 변동 리스크를 최소화하기 위해 향후 환율 하락을 예상하거나, 원가 절감을 통해 원가율을 개선하는 전략을 고려해야 합니다. 이를 통해 환율 급등에 따른 KRW 실손익 압박을 완화시킬 수 있을 것입니다."
executive_summary,,"1. 핵심 성과 요약: 
현재까지의 데이터 분석 결과, 26SS 시즌의 전체 원가율이 0.0%로 산출되었습니다. 평균 TAG와 평균 원가 모두 $0.00으로 집계되었고, YoY 성장률 역시 0.0%를 보이고 있습니다.

2. 주요 리스크 및 기회 요인:
이러한 결과는 데이터가 충분히 수집되지 않았거나 오류가 있음을 시사하며, 이는 비즈니스 결정에 큰 리스크 요인이 될 수 있습니다. 반면, 정확한 데이터 수집과 분석을 통해 기회를 찾아낼 수 있는 잠재력이 있습니다.

3. 전략적 제언:
우선, 데이터 수집 및 관리 프로세스를 점검하고 이상이 있는 경우 수정이 필요합니다. 그리고 원가 관리에 대한 전략을 수립하거나 개선하기 위해 다양한 원가 분석 방법을 활용하는 것을 고려해 봐야 합니다."
=======
prev_usd_cost_rate,,21.4
prev_krw_cost_rate,,21.4
usd_summary,,26SS 시즌 USD 기준 원가율은 21.4%에서 23.0%로 +1.6%p 악화되었습니다. 주요 원인은 재료계 원가율 +1.5%p 변동입니다.
krw_summary,,26SS 시즌 KRW 기준 원가율은 21.4%에서 22.2%로 +0.8%p 악화되었습니다. 환율 3.7% 변동(1350→1300원)으로 USD 기준 +1.6%p 악화 효과가 0.8%p 악화되었습니다.
action_1,,소재비 절감: 원자재 단가 상승(+1.5%p)으로 소재 사양 재검토 및 대체소재 전환 검토 필요.
action_2,,원가 모니터링: USD/KRW 원가율을 분리 관리하여 환율 영향 실시간 추적.
risk_1,,환율 리스크: 환율 -3.7% 변동(1350→1300원)으로 KRW 원가율 -0.8%p 추가 개선. 기준환율 관리 필요.
risk_2,,원자재 리스크: 글로벌 소재 단가 상승으로 원자재 원가율 +1.5%p 상승.
success_1,,원가 구조: 세부 항목별 원가율 모니터링 체계 구축.
success_2,,공급망 안정성: 장기계약 및 소싱 다변화로 원가 안정성 확보.
action summary,,주요 액션: 소재비 절감, 원가 모니터링
risk summary,,주요 리스크: 환율 리스크, 원자재 리스크
success summary,,성공 포인트: 원가 구조, 공급망 안정성
message,,26SS 시즌은 USD 기준 +1.6%p 악화, KRW 기준 +0.8%p 악화되었습니다. 환율 변동이 KRW 원가율에 영향을 미쳤습니다. 단기적으로는 세부 항목별 원가 모니터링, 중기적으로는 소싱 다변화와 공임 효율화를 통한 구조적 원가 방어가 필요합니다.
metrics_title,,주요 지표 요약
metrics_volume,,생산 수량은 전시즌 대비 -99.7% 감소했습니다.
metrics_tag,,평균 TAG는 전시즌 대비 +102.5% 상승했습니다.
metrics_fx,,환율은 1350원에서 1300원으로 -3.7% 하락했습니다.
metrics_conclusion,,전체적으로 수량 -99.7% 변동, TAG +102.5% 변동, 원가 +117.8% 변동으로 안정세를 보였습니다.
executive_summary,,26SS 시즌 원가 분석 결과, USD 기준 원가율은 21.4%에서 23.0%로 +1.6%p 악화되었습니다. KRW 기준으로는 +0.8%p 악화되었으며, 환율 변동이 영향을 미쳤습니다. 세부 항목별 원가율 모니터링과 구조적 원가 절감 노력이 필요합니다.
>>>>>>> Stashed changes
